{
  "$schema": "https://json-schema.org/draft/2020-12/schema",
  "$id": "https://specs.getwololo.dev/eval-result/eval-trial.schema.json",
  "schemaVersion": 1,
  "title": "eval-trial",
  "description": "One trial of an eval run (04-wololo-evals SPEC Section 3.2). Trials are first-class so n=1 verdicts are structurally impossible to hide (DOCTRINE 15.6): every verdict-bearing run persists n_trials of these per arm, paired by (task_fixture, trial_index). eval_log_path is the tenant-namespaced object key of this trial's raw Inspect .eval log, never inlined content.",
  "type": "object",
  "properties": {
    "schemaVersion": { "const": 1 },
    "tenant_id": { "type": "string", "minLength": 1 },
    "run_id": { "type": "string", "minLength": 1 },
    "trial_index": { "type": "integer", "minimum": 0 },
    "arm": { "enum": ["baseline", "treatment", "single"] },
    "status": { "enum": ["running", "completed", "errored"] },
    "model": { "type": "string", "minLength": 1 },
    "harness": { "type": "string", "minLength": 1 },
    "composite": { "type": "number" },
    "eval_log_path": { "type": "string", "minLength": 1 },
    "started_at": {
      "type": "string",
      "pattern": "^\\d{4}-\\d{2}-\\d{2}T\\d{2}:\\d{2}:\\d{2}(\\.\\d+)?(Z|[+-]\\d{2}:\\d{2})$",
      "format": "date-time"
    },
    "completed_at": {
      "type": "string",
      "pattern": "^\\d{4}-\\d{2}-\\d{2}T\\d{2}:\\d{2}:\\d{2}(\\.\\d+)?(Z|[+-]\\d{2}:\\d{2})$",
      "format": "date-time"
    }
  },
  "required": ["schemaVersion", "tenant_id", "run_id", "trial_index", "arm", "status"],
  "additionalProperties": false
}
